RID,原文斷詞,原文出題,原文答案,原文規則,原文出題規則,原文出題答案
274,他_人1 想_v1 以後_f1 就_d1 有_vyou1 好日子_物1 過_v2 了_y1,他想以後有什麼日子過了?,好日子,人1 + v1 + f1 + d1 + vyou1 + 物1 + v2 + y1,人1 + v1 + f1 + vyou1 + 什麼 + v2 + y1,物1
,,,,,,
276,盤古_人1 死_v1 了_y1 以後_f1 ，_w1 他_人2 的_u1 眼睛_人3 變成_v2 了_y2 太陽_物1 和_c1 月亮_物2,盤古死了以後，他的眼睛變成?,太陽,人1 + v1 + y1 + f1 + w1 + 人2 + u1 + 人3 + v2 + y2 + 物1 + c1 + 物2,人1 + v1 + y1 + f1 + w1 + 人2 + u1 + 人3 + v2 + 什麼,物1
277,他_人1 的_u1 身體_物1 變成_v1 山脈_物2,他的身體變成?,山脈,人1 + u1 + 物1 + v1 + 物2,人1 + u1 + 物1 + v1 + 什麼,物2
278,身上_s1 的_u1 血_物1 變成_v1 了_y1 河流_物2,身上的血變成?,河流,s1 + u1 + 物1 + v1 + y1 + 物2,s1 + u1 + 物1 + v1 + 什麼,物2
279,他_人1 的_u1 毛髮_物1 變成_v1 了_y1 樹木_物2,他的毛髮變成?,樹木,人1 + u1 + 物1 + v1 + y1 + 物2,人1 + u1 + 物1 + v1 + 什麼,物2
280,骨頭_人1 變成_v1 石頭_物1,骨頭變成?,石頭,人1 + v1 + 物1,人1 + v1 + 什麼,物1
281,老虎_人1 是_vshi1 森林_物1 裡_f1 最_d1 凶猛_a1 的_u1 動物_物2,誰是森林裡最兇猛的動物?,老虎,人1 + vshi1 + 物1 + f1 + d1 + a1 + u1 + 物2,誰 + vshi1 + 物1 + f1 + d1 + u1 + 物2,人1
282,他_人1 一向_d1 是_vshi1 拿_v1 其他_人2 的_u1 動物_物1 當_v2 餐點_物2 的_u2,他一向是拿什麼當餐點?,動物,人1 + d1 + vshi1 + v1 + 人2 + u1 + 物1 + v2 + 物2 + u2,人1 + d1 + vshi1 + v1 + 什麼 + v2 + 物2,物1
283,狐狸_人1 大_d1 喝_v1 一_m1 聲_q1 ：_w1 「_w2 好_d2 大_a1 的_u1 膽子_物1 ！_w3 你_人2 敢_v2 吃_v3 我_r1 ？_w4,誰大喝一聲?,狐狸,人1 + d1 + v1 + m1 + q1 + w1 + w2 + d2 + a1 + u1 + 物1 + w3 + 人2 + v2 + v3 + r1 + w4,誰 + d1 + v1 + m1 + q1,人1
284,老虎_人1 聽到_v1 狐狸_人2 的_u1 聲音_物1 嚇_v2 了_y1 一_m1 跳_v3,老虎聽到誰的聲音嚇了一跳?,狐狸,人1 + v1 + 人2 + u1 + 物1 + v2 + y1 + m1 + v3,人1 + v1 + 誰 + u1 + 物1 + v2 + y1 + m1 + v3,人2
285,狐狸_人1 說_v1 ：_w1 「_w2 天帝派_n1 我_r1 來_v2 當_v3 森林_物1 之_u1 王_物2,天帝派誰當森林之王?,狐狸,人1 + v1 + w1 + w2 + n1 + r1 + v2 + v3 + 物1 + u1 + 物2,n1 + 誰 + v3 + 物1 + u1 + 物2,人1
286,你_人1 吃_v1 了_y1 我_r1 ，_w1 就_d1 是_vshi1 不_d2 聽_v2 天帝_物1 的_u1 話_物2,吃了我就是不聽誰的話?,你,人1 + v1 + y1 + r1 + w1 + d1 + vshi1 + d2 + v2 + 物1 + u1 + 物2,v1 + y1 + r1 + d1 + vshi1 + d2 + v2 + 誰 + u1 + 物2,人1
287,我_人1 走_v1 在_p1 前面_f1 ，_w1 你_人2 跟_v2 在_p2 我_r1 後面_f2,誰走在前面?,我,人1 + v1 + p1 + f1 + w1 + 人2 + v2 + p2 + r1 + f2,誰 + v1 + p1 + f1,人1
288,我_人1 走_v1 在_p1 前面_f1 ，_w1 你_人2 跟_v2 在_p2 我_r1 後面_f2,誰走在後面?,我,人1 + v1 + p1 + f1 + w1 + 人2 + v2 + p2 + r1 + f2,誰 + v1 + p1 + f2,人1
289,你_人1 仔細_a1 看_v1 ，_w1 森林_物1 裡_f1 的_u1 動物_物2 ，_w2 哪_人2 一個_m1 見_v2 了_y1 我_r1 ，_w3 膽敢_v3 不_d1 逃_v4 命_物3 的_u2 ？_w4,森林裡的動物見了誰膽敢不逃命的?,哪,人1 + a1 + v1 + w1 + 物1 + f1 + u1 + 物2 + w2 + 人2 + m1 + v2 + y1 + r1 + w3 + v3 + d1 + v4 + 物3 + u2 + w4,物1 + f1 + u1 + 物2 + v2 + y1 + 誰 + v3 + d1 + v4 + 物3 + u1,人2
290,老虎_人1 心想_v1 狐狸_人2 說_v2 的_u1 也許_d1 有_vyou1 道理_物1,老虎心想狐狸說的也許有?,道理,人1 + v1 + 人2 + v2 + u1 + d1 + vyou1 + 物1,人1 + v1 + 人2 + v2 + u1 + d1 + vyou1 + 什麼,物1
291,於是_c1 老虎_人1 跟_v1 在_p1 狐狸_物1 的_u1 後面_f1 走_v2,誰跟在狐狸的後面走?,老虎,c1 + 人1 + v1 + p1 + 物1 + u1 + f1 + v2,誰 + v1 + p1 + 物1 + u1 + f1 + v2,人1
292,山羊_人1 很_d1 想_v1 當_v2 科學家_物1,山羊很想當什麼?,科學家,人1 + d1 + v1 + v2 + 物1,人1 + d1 + v1 + v2 + 什麼,物1
293,山羊_人1 很_d1 想_v1 當_v2 科學家_物1,誰很想當科學家?,山羊,人1 + d1 + v1 + v2 + 物1,誰 + d1 + v1 + v2 + 物1,人1
,,,,,,
295,還_d1 把_p1 看到_v1 的_u1 大海_物1 詳細_a1 的_u2 寫_v2 下來_v3,把看到的什麼詳細的寫下來?,大海,d1 + p1 + v1 + u1 + 物1 + a1 + u2 + v2 + v3,p1 + v1 + u1 + 什麼 + a1 + u1 + v2 + v3,物1
296,他_人1 寫_v1 海_物1 的_u1 顏色_物2 海_物3 的_u2 樣子_物4 ，_w1 海鳥_人2 在_p1 海上_s1 飛翔_v2 的_u3 情形_物5,他寫誰在飛翔的情形?,海鳥,人1 + v1 + 物1 + u1 + 物2 + 物3 + u2 + 物4 + w1 + 人2 + p1 + s1 + v2 + u3 + 物5,人1 + v1 + 誰 + p1 + v2 + u1 + 物5,人2
297,山羊_人1 寫_v1 了_y1 厚厚的_z1 一_m1 本_q1 書_物1,山羊寫了什麼?,書,人1 + v1 + y1 + z1 + m1 + q1 + 物1,人1 + v1 + y1 + 什麼,物1
298,他_人1 很_d1 高興_a1 的_u1 對_p1 著_v1 海洋_人2 說_v2 ：_w1 「_w2 我_r1 是_vshi1 個_q1 海洋_物1 專家_物2 了_y1 ！_w3 」_w4,我是個什麼專家?,海洋,人1 + d1 + a1 + u1 + p1 + v1 + 人2 + v2 + w1 + w2 + r1 + vshi1 + q1 + 物1 + 物2 + y1 + w3 + w4,r1 + vshi1 + q1 + 什麼 + 物2,物1
299,正當_p1 山羊_物1 興奮_a1 的_u1 時候_物2 ，_w1 海裡_s1 的_u2 大魚_物3 游_v1 上來_v2,正當山羊興奮得時候，海裡的什麼游上來?,大魚,p1 + 物1 + a1 + u1 + 物2 + w1 + s1 + u2 + 物3 + v1 + v2,p1 + 物1 + a1 + 物2 + w1 + s1 + u1 + 什麼 + v1 + v2,物3
300,但是_c1 你_人1 只是_d1 看到_v1 海_物1 的_u1 外表_物2 ，_w1 這樣_人2 不_d2 能_v2 成為_v3 海洋_物3 專家_n1 的_u2,只是看到海洋的什麼?,外表,c1 + 人1 + d1 + v1 + 物1 + u1 + 物2 + w1 + 人2 + d2 + v2 + v3 + 物3 + n1 + u2,d1 + v1 + 物1 + u1 + 什麼,物2
301,去_v1 了解_v2 海裡物_物1 的_u1 活動_物2,去海裡了解什麼的活動?,海裡物,v1 + v2 + 物1 + u1 + 物2,v1 + v2 + 什麼 + u1 + 物2,物1
,,,,,,
303,決定_v1 請_v2 大魚_人1 和_c1 他_人2 一起_d1 合作_v3,請誰和他一起合作?,大魚,v1 + v2 + 人1 + c1 + 人2 + d1 + v3,v2 + 誰 + c1 + 人2 + d1 + v3,人1
304,後來_人1 山羊_人2 和_c1 大魚_物1 一起_d1 討論_v1,山羊和誰一起討論?,後來,人1 + 人2 + c1 + 物1 + d1 + v1,人2 + c1 + 誰 + d1 + v1,人1
305,還_d1 把_p1 大魚_人1 告訴_v1 他_人2 的_u1 事情_物1 都_d2 寫_v2 進_v3 書_物2 裡_f1,把誰告訴他的事情都寫進書裡?,大魚,d1 + p1 + 人1 + v1 + 人2 + u1 + 物1 + d2 + v2 + v3 + 物2 + f1,p1 + 誰 + v1 + 人2 + u1 + 物1 + d2 + v2 + v3 + 物2 + f1,人1
306,山羊_人1 就_d1 寫_v1 成_v2 了_y1 一_m1 本_q1 很_d2 有用_a1 的_u1 「_w1 海洋_物1 研究_n1 」_w2 了_y2,山羊寫成了一本什麼書?,海洋,人1 + d1 + v1 + v2 + y1 + m1 + q1 + d2 + a1 + u1 + w1 + 物1 + n1 + w2 + y2,人1 + v1 + v2 + y1 + m1 + q1 + 什麼,物1
307,鬍子_物1 起來_v1,什麼翹起來?,鬍子,物1 + v1,什麼 + v1,物1
308,老鼠_人1 看到_v1 貓_物1 ，_w1 驚嚇_v2 得_u1 躲_v3 了_y1 起來_v4 。_w2,誰看到貓，驚嚇得躲了起來?,老鼠,人1 + v1 + 物1 + w1 + v2 + u1 + v3 + y1 + v4 + w2,誰 + v1 + 物1 + w1 + v2 + u1 + v3 + y1 + v4,人1
309,隱士_人1 看_v1 老鼠_物1 可憐_v2 ，_w1 就_d1 把_p1 老鼠_物2 變成_v3 了_y1 大_a1 貓_物3 。_w2,誰看老鼠可憐，就把老鼠變成了大貓?,隱士,人1 + v1 + 物1 + v2 + w1 + d1 + p1 + 物2 + v3 + y1 + a1 + 物3 + w2,誰 + v1 + 物1 + v2 + w1 + d1 + p1 + 物1 + v3 + y1 + a1 + 物3,人1
310,隱士_人1 很_d1 不_d2 忍心_v1 ，_w1 又_d3 把_p1 大_a1 貓_物1 變_v2 成_v3 黃_a2 狗_物2 。_w2,誰很不忍心，又把大貓變成黃狗?,隱士,人1 + d1 + d2 + v1 + w1 + d3 + p1 + a1 + 物1 + v2 + v3 + a2 + 物2 + w2,誰 + d1 + d2 + v1 + w1 + d3 + p1 + a1 + 物1 + v2 + v3 + a2 + 物2,人1
311,隱士_人1 看見_v1 了_y1 ，_w1 又_d1 趕忙_d2 把_p1 大_a1 黃狗_物1 變成_v2 老虎_物2,誰看見了，又趕忙把大黃狗變成老虎?,隱士,人1 + v1 + y1 + w1 + d1 + d2 + p1 + a1 + 物1 + v2 + 物2,誰 + v1 + y1 + w1 + d1 + d2 + p1 + a1 + 物1 + v2 + 物2,人1
312,大_a1 老虎_人1 狠狠_d1 的_u1 瞪_v1 了_y1 隱士_物1 ，_w1 好_a2 像_人2 要_v2 把_p1 隱士_人3 一_m1 口_q1 吞_v3 下去_v4 的_u2 樣子_物2 。_w2,誰狠狠的瞪了隱士，好像要把隱士一口吞下去的樣子?,老虎,a1 + 人1 + d1 + u1 + v1 + y1 + 物1 + w1 + a2 + 人2 + v2 + p1 + 人3 + m1 + q1 + v3 + v4 + u2 + 物2 + w2,誰 + d1 + u1 + v1 + y1 + 物1 + w1 + a2 + 人2 + v2 + p1 + 物1 + m1 + q1 + v3 + v4 + u1 + 物2,人1
313,大_a1 老虎_人1 狠狠_d1 的_u1 瞪_v1 了_y1 隱士_物1 ，_w1 好_a2 像_人2 要_v2 把_p1 隱士_人3 一_m1 口_q1 吞_v3 下去_v4 的_u2 樣子_物2 。_w2,大老虎狠狠的瞪了誰，好像要把隱士一口吞下去的樣子?,隱士,a1 + 人1 + d1 + u1 + v1 + y1 + 物1 + w1 + a2 + 人2 + v2 + p1 + 人3 + m1 + q1 + v3 + v4 + u2 + 物2 + w2,a1 + 人1 + d1 + u1 + v1 + y1 + 誰 + w1 + a2 + 人2 + v2 + p1 + 物1 + m1 + q1 + v3 + v4 + u1 + 物2,人3
314,大_a1 老虎_人1 狠狠_d1 的_u1 瞪_v1 了_y1 隱士_物1 ，_w1 好_a2 像_人2 要_v2 把_p1 隱士_人3 一_m1 口_q1 吞_v3 下去_v4 的_u2 樣子_物2 。_w2,大老虎狠狠的瞪了隱士，好像要把誰一口吞下去的樣子?,隱士,a1 + 人1 + d1 + u1 + v1 + y1 + 物1 + w1 + a2 + 人2 + v2 + p1 + 人3 + m1 + q1 + v3 + v4 + u2 + 物2 + w2,a1 + 人1 + d1 + u1 + v1 + y1 + 物1 + w1 + a2 + 人2 + v2 + p1 + 誰 + m1 + q1 + v3 + v4 + u1 + 物2,人3
315,隱士_人1 長長的_z1 嘆_v1 了_y1 一_m1 口_q1 氣_物1 ，_w1 伸_v2 出手_v3 指頭_物2 向_p1 老虎_物3 一_d1 指_v4 ，_w2 又_d2 把_p2 大_a1 老虎_人2 變成_v5 了_y2 原來_b1 的_u1 那_r1 隻_q2 小_a2 老鼠_物4 。_w3,誰長長的嘆了一口氣，伸出手指頭向老虎一隻，又把大老虎變了原來那隻小老鼠?,隱士,人1 + z1 + v1 + y1 + m1 + q1 + 物1 + w1 + v2 + v3 + 物2 + p1 + 物3 + d1 + v4 + w2 + d2 + p2 + a1 + 人2 + v5 + y2 + b1 + u1 + r1 + q2 + a2 + 物4 + w3,誰 + z1 + v1 + y1 + m1 + q1 + 物1 + w1 + v2 + v3 + 物2 + p1 + 物3 + m1 + q2 + w1 + d2 + p2 + a1 + 物3 + y1 + b1 + r1 + q2 + a2 + 物4,人1
316,隱士_人1 長長的_z1 嘆_v1 了_y1 一_m1 口_q1 氣_物1 ，_w1 伸_v2 出手_v3 指頭_物2 向_p1 老虎_物3 一_d1 指_v4 ，_w2 又_d2 把_p2 大_a1 老虎_人2 變成_v5 了_y2 原來_b1 的_u1 那_r1 隻_q2 小_a2 老鼠_物4 。_w3,隱士長長的嘆了一口氣，伸出手指頭向誰一隻，又把大老虎變了原來那隻小老鼠?,老虎,人1 + z1 + v1 + y1 + m1 + q1 + 物1 + w1 + v2 + v3 + 物2 + p1 + 物3 + d1 + v4 + w2 + d2 + p2 + a1 + 人2 + v5 + y2 + b1 + u1 + r1 + q2 + a2 + 物4 + w3,人1 + z1 + v1 + y1 + m1 + q1 + 物1 + w1 + v2 + v3 + 物2 + p1 + 誰 + m1 + q2 + w1 + d2 + p2 + a1 + 物3 + y1 + b1 + r1 + q2 + a2 + 物4,人2
317,隱士_人1 長長的_z1 嘆_v1 了_y1 一_m1 口_q1 氣_物1 ，_w1 伸_v2 出手_v3 指頭_物2 向_p1 老虎_物3 一_d1 指_v4 ，_w2 又_d2 把_p2 大_a1 老虎_人2 變成_v5 了_y2 原來_b1 的_u1 那_r1 隻_q2 小_a2 老鼠_物4 。_w3,隱士長長的嘆了一口氣，伸出手指頭向老虎一隻，又把誰變了原來那隻小老鼠?,老虎,人1 + z1 + v1 + y1 + m1 + q1 + 物1 + w1 + v2 + v3 + 物2 + p1 + 物3 + d1 + v4 + w2 + d2 + p2 + a1 + 人2 + v5 + y2 + b1 + u1 + r1 + q2 + a2 + 物4 + w3,人1 + z1 + v1 + y1 + m1 + q1 + 物1 + w1 + v2 + v3 + 物2 + p1 + 物3 + m1 + q2 + w1 + d2 + p2 + 誰 + y1 + b1 + r1 + q2 + a2 + 物4,人2
318,隱士_人1 長長的_z1 嘆_v1 了_y1 一_m1 口_q1 氣_物1 ，_w1 伸_v2 出手_v3 指頭_物2 向_p1 老虎_物3 一_d1 指_v4 ，_w2 又_d2 把_p2 大_a1 老虎_人2 變成_v5 了_y2 原來_b1 的_u1 那_r1 隻_q2 小_a2 老鼠_物4 。_w3,隱士長長的嘆了一口氣，伸出手指頭向老虎一隻，又把大老虎變了誰?,老虎,人1 + z1 + v1 + y1 + m1 + q1 + 物1 + w1 + v2 + v3 + 物2 + p1 + 物3 + d1 + v4 + w2 + d2 + p2 + a1 + 人2 + v5 + y2 + b1 + u1 + r1 + q2 + a2 + 物4 + w3,人1 + z1 + v1 + y1 + m1 + q1 + 物1 + w1 + v2 + v3 + 物2 + p1 + 物3 + m1 + q2 + w1 + d2 + p2 + a1 + 物3 + y1 + 誰,人2
319,十一月_物1 十六日_時1 那天_物2 晚上_時2 ，_w1 月亮_物3 圓_a1 ，_w2 也_d1 特別_d2 亮_a2,十一月十六日的何時，月亮特別圓，也特別亮?,晚上,物1 + 時1 + 物2 + 時2 + w1 + 物3 + a1 + w2 + d1 + d2 + a2,物1 + 時1 + 何時 + w1 + 物3 + d2 + a1 + w1 + d1 + d2 + a2,時2
320,十一月_物1 十六日_時1 那天_物2 晚上_時2 ，_w1 月亮_物3 圓_a1 ，_w2 也_d1 特別_d2 亮_a2,十一月十六日那天晚上，什麼特別圓，也特別亮?,月亮,物1 + 時1 + 物2 + 時2 + w1 + 物3 + a1 + w2 + d1 + d2 + a2,物1 + 時1 + 物2 + 時2 + w1 + 什麼 + d2 + a1 + w1 + d1 + d2 + a2,物3
321,我_人1 跟_p1 家人_物1 媽媽_n1 精心_a1 製作_v1 的_u1 水燈_物2 ，_w1 到_v2 河邊_物3 放水_v3 燈_物4 。_w2,誰跟家人提著媽媽精心製作的水燈，到河邊去放水燈?,我,人1 + p1 + 物1 + n1 + a1 + v1 + u1 + 物2 + w1 + v2 + 物3 + v3 + 物4 + w2,誰 + p1 + 物1 + n1 + a1 + v1 + u1 + 物2 + w1 + v2 + 物3 + v3 + 物4,人1
322,我_人1 跟_p1 家人_物1 媽媽_n1 精心_a1 製作_v1 的_u1 水燈_物2 ，_w1 到_v2 河邊_物3 放水_v3 燈_物4 。_w2,我跟家人提著媽媽精心製作的水燈，到河邊去放什麼?,燈,人1 + p1 + 物1 + n1 + a1 + v1 + u1 + 物2 + w1 + v2 + 物3 + v3 + 物4 + w2,人1 + p1 + 物1 + n1 + a1 + v1 + u1 + 物2 + w1 + v2 + 物3 + 什麼,物4
323,我_人1 跟_p1 家人_物1 媽媽_n1 精心_a1 製作_v1 的_u1 水燈_物2 ，_w1 到_v2 河邊_物3 放水_v3 燈_物4 。_w2,我跟家人提著媽媽精心製作的什麼，到河邊去放水燈?,水燈,人1 + p1 + 物1 + n1 + a1 + v1 + u1 + 物2 + w1 + v2 + 物3 + v3 + 物4 + w2,人1 + p1 + 物1 + n1 + a1 + v1 + u1 + 什麼 + w1 + v2 + 物3 + v3 + 物4,物2
324,再_d1 把_p1 長長的_z1 樹葉_物1 ，_w1 摺_v1 成_v2 蓮花_物2 的_u1 花瓣_物3,再把長長的什麼，摺成蓮花的花瓣?,樹葉,d1 + p1 + z1 + 物1 + w1 + v1 + v2 + 物2 + u1 + 物3,d1 + p1 + z1 + 什麼 + w1 + v1 + v2 + 物2 + u1 + 物3,物1
325,媽媽_人1 把_p1 蠟燭_物1 點燃_v1 之後_f1 ，_w1 就_d1 把_p2 水_物2 燈_n1 慢慢_d2 的_u1 放_v2 進_v3 河裡_物3,誰把蠟燭點燃之後，就把水燈慢慢的放進河裡?,媽媽,人1 + p1 + 物1 + v1 + f1 + w1 + d1 + p2 + 物2 + n1 + d2 + u1 + v2 + v3 + 物3,誰 + p1 + 物1 + v1 + f1 + w1 + d1 + p1 + 物2 + n1 + d2 + u1 + v2 + v3 + 物3,人1
326,媽媽_人1 把_p1 蠟燭_物1 點燃_v1 之後_f1 ，_w1 就_d1 把_p2 水_物2 燈_n1 慢慢_d2 的_u1 放_v2 進_v3 河裡_物3,媽媽把什麼點燃之後，就把水燈慢慢的放進河裡?,蠟燭,人1 + p1 + 物1 + v1 + f1 + w1 + d1 + p2 + 物2 + n1 + d2 + u1 + v2 + v3 + 物3,人1 + p1 + 什麼 + v1 + f1 + w1 + d1 + p1 + 物2 + n1 + d2 + u1 + v2 + v3 + 物3,物1
327,媽媽_人1 把_p1 蠟燭_物1 點燃_v1 之後_f1 ，_w1 就_d1 把_p2 水_物2 燈_n1 慢慢_d2 的_u1 放_v2 進_v3 河裡_物3,媽媽把蠟燭點燃之後，就把什麼慢慢的放進河裡?,水,人1 + p1 + 物1 + v1 + f1 + w1 + d1 + p2 + 物2 + n1 + d2 + u1 + v2 + v3 + 物3,人1 + p1 + 物1 + v1 + f1 + w1 + d1 + p1 + 什麼 + d2 + u1 + v2 + v3 + 物3,物2
328,媽媽_人1 告訴_v1 我們_人2 ，_w1 原本_d1 放水_v2 燈_物1 是_vshi1 要_v3 祭拜_v4 河神_物2 的_u1,誰告訴我們，原本放水燈是要祭拜河神的?,媽媽,人1 + v1 + 人2 + w1 + d1 + v2 + 物1 + vshi1 + v3 + v4 + 物2 + u1,誰 + v1 + 人2 + w1 + d1 + v2 + 物1 + vshi1 + v3 + v4 + 物2 + u1,人1
329,媽媽_人1 告訴_v1 我們_人2 ，_w1 原本_d1 放水_v2 燈_物1 是_vshi1 要_v3 祭拜_v4 河神_物2 的_u1,媽媽告訴我們，原本放什麼是要祭拜河神的?,燈,人1 + v1 + 人2 + w1 + d1 + v2 + 物1 + vshi1 + v3 + v4 + 物2 + u1,人1 + v1 + 人2 + w1 + d1 + 什麼 + vshi1 + v3 + v4 + 物2 + u1,物1
330,現在_時1 放水_v1 燈_物1 的_u1 人_物2 ，_w1 除了_p1 請_v2 河神_人1 帶走_v3 災難_人2 也_d1 把_p2 自己_人3 的_u2 心願_物3 告訴_v4 河神_物4 ，_w2 請求_v5 神明_物5 的_u3 保佑_物6,現在放水燈的人，除了請誰帶走災難，也把自己的心願告訴誰，請求神明的保佑,河神,時1 + v1 + 物1 + u1 + 物2 + w1 + p1 + v2 + 人1 + v3 + 人2 + d1 + p2 + 人3 + u2 + 物3 + v4 + 物4 + w2 + v5 + 物5 + u3 + 物6,時1 + v1 + 物1 + u1 + 物2 + w1 + p1 + v2 + 誰 + v3 + 人2 + w1 + d1 + p2 + 人3 + u1 + 物3 + v4 + 誰 + w1 + v2 + 物5 + u1 + 物6,人1
331,大家_人1 站_v1 在_p1 河邊_物1 ，_w1 輕輕的_z1 把_p2 水_物2 燈_物3 河裡_s1,大家站在河邊，輕輕的把什麼放入河裡?,水,人1 + v1 + p1 + 物1 + w1 + z1 + p2 + 物2 + 物3 + s1,人1 + v1 + p1 + 物1 + w1 + z1 + p2 + 什麼 + s1,物2
332,雙手_人1 合十_nrf1 向_p1 神明_物1 許願_v1 ，_w1 請求_v2 神明_物2 的_u1 保佑_物3,雙手合十向神明許願，請求神明的什麼?,保佑,人1 + nrf1 + p1 + 物1 + v1 + w1 + v2 + 物2 + u1 + 物3,人1 + nrf1 + p1 + 物1 + v1 + w1 + v2 + 物1 + u1 + 什麼,物3
333,我們_人1 知道_v1 ，_w1 過_u1 去_v2 的_u2 災難_人2 都_d1 隨_v3 著水燈_物1 消失_v4 了_y1 ，_w2 美好_a1 的_u3 未來_t1 正在_d2 等_v5 著_v6 我們_r1 。_w3,我們知道，過去的災難都隨著什麼消失了，美好的未來正在等著我們?,著水燈,人1 + v1 + w1 + u1 + v2 + u2 + 人2 + d1 + v3 + 物1 + v4 + y1 + w2 + a1 + u3 + t1 + d2 + v5 + v6 + r1 + w3,人1 + v1 + w1 + u1 + v2 + u2 + 人2 + d1 + v3 + v6 + 什麼 + v4 + y1 + w1 + a1 + u2 + t1 + d2 + v5 + v6 + 人1,物1
334,紅色_人1 珊瑚_物1 的_u1 附近_f1 ，_w1 有_vyou1 張開_v1 的_u2 海葵_物2 。_w2,紅色珊瑚的附近，有張開的什麼?,海葵,人1 + 物1 + u1 + f1 + w1 + vyou1 + v1 + u2 + 物2 + w2,人1 + 物1 + u1 + f1 + w1 + vyou1 + v1 + u1 + 什麼,物2
335,像_p1 遊客_物1 來來往往_v1 ，_w1 是_vshi1 一群群_m1 的_u1 彩魚_物2 。_w2,像遊客來來往往，是一群群的什麼?,彩魚,p1 + 物1 + v1 + w1 + vshi1 + m1 + u1 + 物2 + w2,p1 + 物1 + v1 + w1 + vshi1 + m1 + u1 + 什麼,物2
336,燈籠_人1 魚_人2 日夜_d1 不_d2 分_v1 ，_w1 出門_v2 都_d3 帶_v3 著_v4 燈籠_物1 。_w2,誰日夜不分，出門都帶著燈籠?,魚,人1 + 人2 + d1 + d2 + v1 + w1 + v2 + d3 + v3 + v4 + 物1 + w2,誰 + d1 + d2 + v1 + w1 + v2 + d3 + v3 + v4 + 人1,人2
337,燈籠_人1 魚_人2 日夜_d1 不_d2 分_v1 ，_w1 出門_v2 都_d3 帶_v3 著_v4 燈籠_物1 。_w2,燈籠魚日夜不分，出門都帶著什麼?,燈籠,人1 + 人2 + d1 + d2 + v1 + w1 + v2 + d3 + v3 + v4 + 物1 + w2,人1 + 人2 + d1 + d2 + v1 + w1 + v2 + d3 + v3 + v4 + 什麼,物1
338,獅子魚_人1 不_d1 像_v1 獅子_物1 ，_w1 卻_d2 像_v2 一_m1 隻_q1 花_a1 蝴蝶_物2 。_w2,誰不像獅子，卻像一隻花蝴蝶?,獅子魚,人1 + d1 + v1 + 物1 + w1 + d2 + v2 + m1 + q1 + a1 + 物2 + w2,誰 + d1 + v1 + 物1 + w1 + d2 + v1 + m1 + q1 + a1 + 物2,人1
339,獅子魚_人1 不_d1 像_v1 獅子_物1 ，_w1 卻_d2 像_v2 一_m1 隻_q1 花_a1 蝴蝶_物2 。_w2,獅子魚不像什麼，卻像一隻花蝴蝶?,獅子,人1 + d1 + v1 + 物1 + w1 + d2 + v2 + m1 + q1 + a1 + 物2 + w2,人1 + d1 + v1 + 什麼 + w1 + d2 + v1 + m1 + q1 + a1 + 物2,物1
340,獅子魚_人1 不_d1 像_v1 獅子_物1 ，_w1 卻_d2 像_v2 一_m1 隻_q1 花_a1 蝴蝶_物2 。_w2,獅子魚不像獅子，卻像一隻什麼?,蝴蝶,人1 + d1 + v1 + 物1 + w1 + d2 + v2 + m1 + q1 + a1 + 物2 + w2,人1 + d1 + v1 + 物1 + w1 + d2 + v1 + m1 + q1 + 什麼,物2
341,孔子_人1 說_v1 ：_w1 「_w2 能_v2 養活_v3 父母_物1 是_vshi1 孝_物2 的_u1 行為_物3 。_w3 」_w4,誰說:「 能養活父母是孝的行為。」?,孔子,人1 + v1 + w1 + w2 + v2 + v3 + 物1 + vshi1 + 物2 + u1 + 物3 + w3 + w4,誰 + v1 + w2 + v2 + v3 + 物1 + vshi1 + 物2 + u1 + 物3 + w3 + w4,人1
342,所以_c1 孝順_v1 父母_物1 ，_w1 不只_c2 是_vshi1 給_p1 父母_物2 溫飽_物3 ，_w2 還要_d1 有_vyou1 好_a1 的_u1 態度_物4 才_d2 是_vshi2 孝_物5 。_w3,所以孝順父母，不只是給父母溫飽，還要有好的什麼才是孝?,態度,c1 + v1 + 物1 + w1 + c2 + vshi1 + p1 + 物2 + 物3 + w2 + d1 + vyou1 + a1 + u1 + 物4 + d2 + vshi2 + 物5 + w3,c1 + v1 + 物1 + w1 + c2 + vshi1 + p1 + 物1 + 物3 + w1 + d1 + vyou1 + a1 + u1 + 什麼 + d2 + vshi1 + 物5,物4
343,我們_人1 不_d1 只_d2 是_vshi1 幫_v1 父母親_物1 做事_v2 ，_w1 給_p1 父母_物2 喝酒_v3 ，_w2 吃_v4 肉_物3,我們不只是幫父母做事，給父母喝酒，吃什麼?,肉,人1 + d1 + d2 + vshi1 + v1 + 物1 + v2 + w1 + p1 + 物2 + v3 + w2 + v4 + 物3,人1 + d1 + d2 + vshi1 + v1 + 物2 + v2 + w1 + p1 + 物2 + v3 + w1 + v4 + 什麼,物3
344,如果_c1 不_d1 給_v1 好_a1 臉色_物1 ，_w1 就_d2 不_d3 算是_v2 孝順_v3 了_y1 。_w2,如果不給好的什麼，就不算是孝順了?,臉色,c1 + d1 + v1 + a1 + 物1 + w1 + d2 + d3 + v2 + v3 + y1 + w2,c1 + d1 + v1 + a1 + 什麼 + w1 + d2 + d1 + v2 + v3 + y1,物1
345,他們_人1 駕_v1 著_v2 自己_人2 所_u1 造_v3 的_u2 飛機_物1 ，_w1 終於_d1 平穩_a1 的_u3 飛_v4 起來_v5 了_y1,他們駕著自己所造的什麼，終於平穩的飛起來了?,飛機,人1 + v1 + v2 + 人2 + u1 + v3 + u2 + 物1 + w1 + d1 + a1 + u3 + v4 + v5 + y1,人1 + v1 + v2 + 人2 + u1 + v3 + u2 + 什麼 + w1 + d1 + a1 + u2 + v4 + v5 + y1,物1
346,從前_時1 有_vyou1 一個_m1 人_物1 ，_w1 種_v1 了_y1 許多_m2 漆樹_物2 。_w2,從前有一個人，種了許多什麼?,漆樹,時1 + vyou1 + m1 + 物1 + w1 + v1 + y1 + m2 + 物2 + w2,時1 + vyou1 + m1 + 物1 + w1 + v1 + y1 + m2 + 什麼,物2
347,他_人1 每年_r1 割_v1 樹皮_物1 取_v2 樹_物2 汁_物3 ，_w1 把_p1 樹汁_物4 在_p2 木桶_物5 裡_f1 ，_w2 運_v3 到_v4 大_a1 城市_物6 去_v5 賣_v6 。_w3,他每年割什麼取樹汁，把樹汁裝在木桶裡，運到大城市去賣?,樹皮,人1 + r1 + v1 + 物1 + v2 + 物2 + 物3 + w1 + p1 + 物4 + p2 + 物5 + f1 + w2 + v3 + v4 + a1 + 物6 + v5 + v6 + w3,人1 + r1 + v1 + 什麼 + v2 + 物2 + 物3 + w1 + p1 + 物2 + 物3 + p2 + 物5 + f1 + w1 + v3 + v4 + a1 + 物6 + v5 + v6,物1
348,他_人1 每年_r1 割_v1 樹皮_物1 取_v2 樹_物2 汁_物3 ，_w1 把_p1 樹汁_物4 在_p2 木桶_物5 裡_f1 ，_w2 運_v3 到_v4 大_a1 城市_物6 去_v5 賣_v6 。_w3,他每年割樹皮取什麼，把什麼裝在木桶裡，運到大城市去賣?,樹,人1 + r1 + v1 + 物1 + v2 + 物2 + 物3 + w1 + p1 + 物4 + p2 + 物5 + f1 + w2 + v3 + v4 + a1 + 物6 + v5 + v6 + w3,人1 + r1 + v1 + 物1 + v2 + 什麼 + w1 + p1 + 什麼 + p2 + 物5 + f1 + w1 + v3 + v4 + a1 + 物6 + v5 + v6,物2
349,他_人1 每年_r1 割_v1 樹皮_物1 取_v2 樹_物2 汁_物3 ，_w1 把_p1 樹汁_物4 在_p2 木桶_物5 裡_f1 ，_w2 運_v3 到_v4 大_a1 城市_物6 去_v5 賣_v6 。_w3,他每年割樹皮取樹汁，把樹汁裝在什麼裡，運到大城市去賣?,木桶,人1 + r1 + v1 + 物1 + v2 + 物2 + 物3 + w1 + p1 + 物4 + p2 + 物5 + f1 + w2 + v3 + v4 + a1 + 物6 + v5 + v6 + w3,人1 + r1 + v1 + 物1 + v2 + 物2 + 物3 + w1 + p1 + 物2 + 物3 + p2 + 什麼 + f1 + w1 + v3 + v4 + a1 + 物6 + v5 + v6,物5
350,大_a1 城市_人1 裡_f1 的_u1 商人_人2 都_d1 知道_v1 他_r1 賣_v2 的_u2 漆_物1 最_d2 純_a2 了_y1 ，_w1 所以_c1 都_d3 樂意_v3 向_p1 他_r2 買_v4 。_w2,大城市的商人都知道他賣的什麼最純了，所以都樂意向他買?,漆,a1 + 人1 + f1 + u1 + 人2 + d1 + v1 + r1 + v2 + u2 + 物1 + d2 + a2 + y1 + w1 + c1 + d3 + v3 + p1 + r2 + v4 + w2,a1 + 人1 + u1 + 人2 + d1 + v1 + r1 + v2 + u1 + 什麼 + d2 + a2 + y1 + w1 + c1 + d1 + v3 + p1 + r1 + v4,物1
351,只要_c1 把_p1 漆樹_人1 的_u1 葉子_物1 煮_v1 成_v2 膏_物2 ，_w1 加_v3 到_v4 生漆_物3 裡_f1 ，_w2 就_d1 可以_v5 讓_v6 漆汁_物4 變_v7 得_u2 更_d2 多_a1,只要把漆樹的什麼煮成膏加到生漆裡，就可以讓漆汁變得更多?,葉子,c1 + p1 + 人1 + u1 + 物1 + v1 + v2 + 物2 + w1 + v3 + v4 + 物3 + f1 + w2 + d1 + v5 + v6 + 物4 + v7 + u2 + d2 + a1,c1 + p1 + 人1 + u1 + 什麼 + v1 + v2 + 物2 + v3 + v4 + 物3 + f1 + w1 + d1 + v5 + v6 + 物4 + v7 + u2 + d2 + a1,物1
352,只要_c1 把_p1 漆樹_人1 的_u1 葉子_物1 煮_v1 成_v2 膏_物2 ，_w1 加_v3 到_v4 生漆_物3 裡_f1 ，_w2 就_d1 可以_v5 讓_v6 漆汁_物4 變_v7 得_u2 更_d2 多_a1,只要把漆樹的葉子煮成膏加到什麼裡，就可以讓漆汁變得更多?,生漆,c1 + p1 + 人1 + u1 + 物1 + v1 + v2 + 物2 + w1 + v3 + v4 + 物3 + f1 + w2 + d1 + v5 + v6 + 物4 + v7 + u2 + d2 + a1,c1 + p1 + 人1 + u1 + 物1 + v1 + v2 + 物2 + v3 + v4 + 什麼 + f1 + w1 + d1 + v5 + v6 + 物4 + v7 + u2 + d2 + a1,物3
353,只要_c1 把_p1 漆樹_人1 的_u1 葉子_物1 煮_v1 成_v2 膏_物2 ，_w1 加_v3 到_v4 生漆_物3 裡_f1 ，_w2 就_d1 可以_v5 讓_v6 漆汁_物4 變_v7 得_u2 更_d2 多_a1,只要把漆樹的葉子煮成膏加到生漆裡，就可以讓什麼變得更多?,漆汁,c1 + p1 + 人1 + u1 + 物1 + v1 + v2 + 物2 + w1 + v3 + v4 + 物3 + f1 + w2 + d1 + v5 + v6 + 物4 + v7 + u2 + d2 + a1,c1 + p1 + 人1 + u1 + 物1 + v1 + v2 + 物2 + v3 + v4 + 物3 + f1 + w1 + d1 + v5 + v6 + 什麼 + v7 + u2 + d2 + a1,物4
354,如果_c1 我_人1 賣_v1 假_a1 漆_物1 ，_w1 我_人2 就_d1 是_vshi1 騙子_物2,如果我賣什麼，我就是騙子?,漆,c1 + 人1 + v1 + a1 + 物1 + w1 + 人2 + d1 + vshi1 + 物2,c1 + 人1 + v1 + 什麼 + w1 + 人1 + d1 + vshi1 + 物2,物1
355,他_人1 的_u1 四周_f1 有_vyou1 一_m1 群_q1 小小的_z1 人兒_物1 ，_w1 一個個_m2 拿_v1 著_v2 弓箭_物2 ，_w2 把_p1 箭頭_人2 對準_v3 了_y1 他_r1,他的四周有一群小小的人兒，一個個拿著什麼，把箭頭對準了他?,弓箭,人1 + u1 + f1 + vyou1 + m1 + q1 + z1 + 物1 + w1 + m2 + v1 + v2 + 物2 + w2 + p1 + 人2 + v3 + y1 + r1,人1 + u1 + f1 + vyou1 + m1 + q1 + z1 + 物1 + w1 + m1 + v1 + v2 + 什麼 + w1 + p1 + 人2 + v3 + y1 + 人1,物2
